{
  "schema_version": "1.1",
  "id": "edge-atlas-asset-live-probe-main-part_of-area-engine-live-probe",
  "from": "atlas-asset-live-probe-main",
  "to": "area-engine-live-probe",
  "relation": "PART_OF",
  "label": "located in",
  "confidence": "high",
  "evidence_refs": [
    "round-live-probe-1-evidence-1"
  ],
  "created_at": "2026-07-21T11:09:42.714Z",
  "updated_at": "2026-07-21T11:09:42.714Z"
}
