{
  "schema_version": "1.1",
  "id": "edge-atlas-asset-live-probe-main-learned_through-atlas-slice-slice-live-probe-main",
  "from": "atlas-asset-live-probe-main",
  "to": "atlas-slice-slice-live-probe-main",
  "relation": "LEARNED_THROUGH",
  "label": "learned through",
  "confidence": "high",
  "evidence_refs": [
    "round-live-probe-1-evidence-1"
  ],
  "created_at": "2026-07-21T11:09:42.716Z",
  "updated_at": "2026-07-21T11:09:42.716Z"
}
